text,label
premier casting u.s. withdrawal as iraq victory,0
"a man returned his wife's ""woman of the year"" award after caitlyn jenner received one",1
"jimmy fallon is getting his own ride at universal based on the ""tonight show""",1
concerns raised over 2 obama advisers tied to a citigroup unit that lost money,0
new australian industrial relations legislation passes house of representatives,0
16 painfully honest confessions from people into bdsm,1
murder charge dropped against us marine who admitted killing iraqi detainee,0
apple introduces iphone and apple tv,0
this 87-year-old granny gives zero fucks and she is everyone's idol,1
how to make the ultimate spaghetti with red sauce,1
daylight savings is the literal worst and no one is talking about it,1
19 wedding photos you'll want to pin right now,1
a new jets administration promises change,0
kylie jenner has mint green hair,1
brazilians call for arrest of uk policemen after shooting death,0
23 totally amazing bodycon looks you'll wanna rock this fall,1
will you be fooled by these basic science questions,1
arinze and tettamanzi equal favorites as new pope,0
hugh jackman thinks tom hardy should be the next wolverine,1
inventor of instant noodles passes away,0
donald brown is n.f.l. prospect with more on his mind than the draft,0
obama has no plans to reopen nafta talks,0
"japan, australia draw in world cup qualifier",0
"nick hogan, son of wrestling star hulk hogan 'seriously injured' in vehicle accident",0
this color test will determine where you like to have sex,1
boeing unveils new 787 dreamliner,0
"bernard lagat wins mile at millrose, tying record",0
u.n. pulls out of southern somalia,0
knicks end losing streak by holding off the hornets,0
markets rally as world's central banks infuse cash,0
canadavotes: ndp candidate michael mcmahon running in prince edward—hastings,0
white supremacist new zealanders provoked by sydney riots,0
"investigation launched after small aircraft crashes on philippines mountain, killing two",0
the 32 dumbest things that happened in 2015,1
benedict cumberbatch had the best response ever to a mean tweet about his appearance,1
"people who have never seen ""star wars"" guess character names and fail adorably",1
fools' gold: how a controversial hit discovery channel show went from boom to bust,1
"israeli settlement growth must stop, clinton says",0
this pup broke a world record and proves dogs are better than everyone,1
21 tweets about makeup that will make you laugh every time,1
thousands gather in london to protest against government cuts,0
36 signs that actually deserve your attention,1
what kind of pop-tart matches your personality,1
last wwii comanche 'code talker' dies,0
